{
  "schema_version": 3,
  "program": "RWWPO-2",
  "branch": "h20/qwen25-7b-tf-rwwpo-t25-frozen-20260822",
  "status": "IMPLEMENTED_STATIC_RELEASE_GO_NO_H20",
  "method_cells": {
    "D": {"objective_variant": "original_tokenwise", "controller_variant": "none"},
    "C": {"objective_variant": "original_tokenwise", "controller_variant": "feasible_backtracking"},
    "E": {"objective_variant": "per_write_joint", "controller_variant": "feasible_backtracking"},
    "B": {"objective_variant": "whole_prefix", "controller_variant": "feasible_backtracking"},
    "A": {"objective_variant": "whole_prefix", "controller_variant": "hard_rollback", "maximum_round": 50}
  },
  "method": {
    "enabled_from_update": 1,
    "inner_transactions_per_round": 2,
    "optimizer_minibatches_per_inner_transaction": 1,
    "optimizer_steps_per_inner_transaction": 1,
    "old_log_prob_refresh": "once_per_rollout_round",
    "advantage_refresh": "once_per_rollout_round",
    "denominator_refresh": "once_per_rollout_round",
    "proposal_clock": "2*(round_id-1)+inner_id",
    "proposal_schedule": {"kind": "constant_with_linear_warmup", "base_lr": 0.000001, "warmup_proposals": 2, "total_proposals": 800},
    "logical_seed_fields": ["experiment_seed", "round_id", "inner_id", "rank", "stream"],
    "attempt_id_in_algorithmic_seed": false,
    "q_min": 0.5,
    "root_q_min": 0.5,
    "writer_log_ratio_cap": 4.0,
    "alpha_grid": [1.0, 0.5, 0.25, 0.125, 0.0625, 0.03125],
    "shadow_host_rounds": [1, 10, 25, 50, 100, 200, 300, 400],
    "r50_shadow_every_round_through": 50,
    "numeric_thresholds": "PENDING_PRE_R50_BF16_FSDP_ORACLE_FAILS_GPU_PREFLIGHT",
    "maximum_root_loo_feasibility_flip_fraction": 0.25,
    "r50_minimum_eligible_rounds_per_host": 40,
    "r50_minimum_exposed_rounds_per_host": 10,
    "r50_minimum_exposure_rate_per_host": 0.2,
    "r50_minimum_geometry_activation_count_given_exposed": 5,
    "r50_minimum_geometry_activation_rate_given_exposed": 0.5,
    "allowed_differences": ["writer_surrogate", "prefix_constraint", "transactional_controller", "two_inner_transactions", "stateless_proposal_clock", "actual_loss_tensor_ledger", "experiment_identity", "output_paths"]
  },
  "training": {
    "mechanism_seeds": [2026, 2027, 2028],
    "confirmatory_seed_count_minimum": 8,
    "confirmatory_seed_values": [2026, 2027, 2028, 2029, 2030, 2031, 2032, 2033],
    "train_batch_size": 4,
    "rollout_n": 2,
    "ppo_mini_batch_size": 4,
    "ppo_epochs": 2,
    "target_rounds": 400,
    "r50_mechanism_gate": 50,
    "planned_prompt_groups_per_seed_cell": 1600,
    "planned_trajectories_per_seed_cell": 3200,
    "maximum_actor_proposals_per_seed_cell": 800,
    "critic_optimizer_updates": 0,
    "auxiliary_fit_updates": 0,
    "chunk_size": 5000,
    "max_chunks": 8,
    "max_prompt_length": 8192,
    "runtime_effective_prompt_filter_length": 40000,
    "max_response_length": 1024,
    "learning_rate": 0.000001,
    "loss_agg_mode": "token-mean",
    "clip_ratio": 0.2,
    "clip_ratio_low": 0.2,
    "clip_ratio_high": 0.2,
    "clip_ratio_c": 3.0,
    "use_kl_loss": true,
    "kl_loss_type": "low_var_kl",
    "kl_loss_coefficient": 0.001,
    "entropy_coefficient": 0.0,
    "shuffle": false
  },
  "checkpointing": {
    "full_recovery_frequency_rounds": 10,
    "full_recovery_keep": 2,
    "scientific_actor_anchors": [5, 10, 15, 20, 25, 50, 100, 200, 300, 400],
    "resume_requires_complete_audit": true,
    "attempt_roots_append_only": true
  },
  "performance": {
    "s128_role": "adaptive_development_only_forbidden_during_r50_and_r400_training",
    "confirmation_minimum_examples": 512,
    "confirmation_status": "PENDING_SEALED_DISJOINT_MATERIALIZATION",
    "confirmation_generation_seed": 918273645,
    "confirmation_decoding": {"do_sample": false, "temperature": 0.0, "top_p": 1.0, "n": 1},
    "primary_metric": "macro_token_f1",
    "key_secondary": "strict_normalized_exact_match",
    "co_primary_contrasts": ["B-D", "B-E"],
    "confirmatory_unit": "paired_training_seed_difference_in_root_macro_token_f1",
    "family_wise_procedure": "one_sided_exact_paired_sign_flip_plus_holm_0.05",
    "sign_flip_assumption": "margin_centered_seed_differences_are_independent_and_sign_symmetric_under_the_boundary_null",
    "minimum_effects": {"B-D": 0.02, "B-E": 0.01},
    "zero_handling": "retain_zero_centered_seed_differences_in_all_sign_flip_assignments",
    "holm_ordering": "ascending_raw_exact_p_then_step_down_at_family_alpha_0.05"
  },
  "model": {"id": "Qwen/Qwen2.5-7B-Instruct", "revision": "a09a35458c702b33eeacc393d103063234e8bc28"},
  "data": {
    "train_sha256": "798b7a2a9ece4f40884e2a9d02d165d7352df7763d1569ceaf402b45f76896f8",
    "s128_sha256": "54c71348875c8d535d1eebd3bb0ebdb7264297d01b3ec5d225cf8be0e9e77ff6",
    "train_s128_content_overlap": "PENDING_H20_CONTENT_HASH_AUDIT",
    "confirmatory_inventory": "PENDING"
  },
  "gpu": {"count": 2, "dynamic_explicit_pair": true, "canonical_ascending": true, "lock_template": "locks/memagent_h20_gpu_N.lock"},
  "backend": {"rollout": "vllm", "strict": true, "hf_fallback": false}
}
